{
  "$schema": "https://json-schema.org/draft/2020-12/schema",
  "$id": "https://raw.githubusercontent.com/songluyi/SAIF-Protocol/v0.3.0/schemas/request.schema.json",
  "x-saif-version": "0.3.0",
  "title": "SAIF Request",
  "description": "A structured business requirement created by an Agent.",
  "type": "object",
  "required": [
    "id",
    "type",
    "created_at",
    "metadata",
    "agent_id",
    "status",
    "requirement"
  ],
  "properties": {
    "id": {
      "type": "string"
    },
    "type": {
      "type": "string",
      "enum": [
        "purchase",
        "document_print",
        "service",
        "maintenance"
      ]
    },
    "created_at": {
      "type": "string",
      "format": "date-time"
    },
    "metadata": {
      "type": "object"
    },
    "agent_id": {
      "type": "string"
    },
    "status": {
      "type": "string",
      "enum": [
        "DRAFT",
        "SUBMITTED",
        "AUTHORIZED",
        "REJECTED",
        "CONVERTED"
      ]
    },
    "requirement": {
      "type": "object",
      "minProperties": 1
    }
  },
  "additionalProperties": false
}
