{
  "id": "req_print_001",
  "type": "document_print",
  "created_at": "2026-08-08T08:05:00Z",
  "metadata": {
    "environment": "example"
  },
  "agent_id": "agent_002",
  "status": "SUBMITTED",
  "requirement": {
    "document_ref": "document_demo_001",
    "copies": 2,
    "color": false,
    "paper_size": "A4"
  }
}
